Comment_ID,Author_ID,Author,Text,Likes,Comment_Date,sentiment
7313066662742459141,6834408463038202882,applpaws,@binnnng⚡ inii cantik bgt yogyakarta,0,2023-12-16 12:53:59,positive
7313058855012287234,6658728035070869505,jerukmanis_068,Besok pulang ya sama @andokering,0,2023-12-16 12:23:38,positive
7313054219820565253,6955848500013696002,utramenterbit,kamu dan joga satu tahun lalu🗿,0,2023-12-16 12:05:49,positive
7313026574907228934,7215939318229517339,mmhadiwisnu1234,insyaallah tgl 19 des otw jogja..🥰,0,2023-12-16 10:18:31,neutral
7313018631041024774,7240871096681088001,.cel24,pen blik ke jogja lgi,0,2023-12-16 09:47:32,positive
7312978985766961926,7220675299968025605,cmiwiwwee,INI LAGU ADEM BGTT😭😭,0,2023-12-16 07:13:48,neutral
7312973980217033478,7062882544253174785,paundrapanca,niatnya ke Jogja mau main sama dia eh dianya main sama orang lain,0,2023-12-16 06:54:18,negative
7312957215614305029,7232283847676888090,slikerr_2,"jogja tunggu aku ya, tahun depan aku ke sana",0,2023-12-16 05:49:28,neutral
7312950521030001413,6902386409253798913,lovesweety.5,doainn smoga bulan ini jadii🥺🥺,0,2023-12-16 05:23:11,positive
7312864251265254149,7231543422409671707,afikhaa_,mauuu ke jogjaaa 😭😭😭,0,2023-12-15 23:48:29,negative
7312853185797800709,6863294106375832577,lollyangels,kangen bgt sama jogja🫶🏻,0,2023-12-15 23:05:31,positive
7312846713981960965,6812862641833280514,rannyyyss,jogjaaa tunggu akuu yaa,0,2023-12-15 22:40:19,neutral
7312842729792848646,6814274097327014913,betterlynn,🤲🏻,0,2023-12-15 22:24:53,negative
7312841497815843590,7203616798075700251,akucahdesaa,jogja🥰,0,2023-12-15 22:20:06,positive
7312840144116908806,7250736910350746629,ghprib,kangenn jogjaaa,0,2023-12-15 22:14:54,neutral
7312831533500613382,6856275418825131009,nadiazftry,cpt’ mau kuliah di jogja🥺,0,2023-12-15 21:41:31,positive
7312812513274790661,6856008290700493825,r0xiieee,manifest taun depan bs ke jogja sendiri,0,2023-12-15 20:27:38,positive
7312809808343335686,6901964726922675201,dindaamlyya,semalem gue kesituu😭🥰🤩,0,2023-12-15 20:17:12,negative
7312808330521494278,7277412140339905542,sweetsxyss,jadi kgenn sama Kaka ku yg rantau Yogyakarta 🥺,0,2023-12-15 20:11:20,neutral
7312808218739114757,7077969687463805953,prilifa_,YOGYA kota bikin ngangenin yaa,0,2023-12-15 20:10:54,neutral
7312804599772087045,6763945013443331073,ilhamafandhy,bismillahirrahmanirrahim tanggal 20 Januari ke Jogja staditour,0,2023-12-15 19:56:54,positive
7312758911534105349,7234891427267068934,raradyah_,jogjaa tunggu aku Januari aku ke sana,0,2023-12-15 17:56:36,neutral
7312770409986818821,7157504102858638363,eclipsselene,MAUU KE JOGJAAA😵‍💫😵‍💫,0,2023-12-15 17:44:14,neutral
7312763351536796422,6960925876075299841,rilllll_09,pengen Pindah ke jogja..,0,2023-12-15 17:17:04,positive
7312758345139110661,7298713450409427974,theonlyraa.__,"Jogja tunggu aku yaa, februari aku ke sanaa",0,2023-12-15 16:57:30,neutral
7312756955990409990,6655877864442986498,aaya12345_7,kapan bisa ya ke Jogja 🥲,0,2023-12-15 16:52:15,neutral
7312755650731754245,7249210820075832326,princeyou16,kemarin baru ke Malioboro,0,2023-12-15 16:47:17,neutral
7312752178979619590,79520864439,ok_sippp,@husnaaa🎀🧸💌 2024 gass naaa,0,2023-12-15 16:33:41,neutral
7312743974132253445,7050364067849159682,rajuoktavian,@shafirarossy jogja yukkk,0,2023-12-15 16:01:49,positive
7312741325013893893,7067761973145289754,nisaaafp,AKU TMN SDKU DAN JOGJA WAKTU ITUU,0,2023-12-15 15:51:34,neutral
7312732784554984198,7179253422284276737,cahayamutia_hafidz,"jogjaaaa tunggu akuuu, Januari aku kesanaaaaaa",0,2023-12-15 15:18:17,neutral
7312730086506644229,7127833236894581787,sayapperi57,ndak bs move on dr jogja 💜💜💜,0,2023-12-15 15:07:59,negative
7312726585181700869,6731057713038279682,restuansyahh4,jogja tunggu januari yaa,0,2023-12-15 14:54:26,neutral
7312725598237246214,6961767557750866945,vv_mine,kangen Jogja🥺🥺,0,2023-12-15 14:50:40,positive
7312717479524041477,7210672135558677531,user14ka,kangen jogja pada kala itu (studytour) 😁,0,2023-12-15 14:19:07,neutral
7312704985959531269,6803326970995229697,ilhamsuryono27,"fyp ku tentang jogja, gas lah 2 Januari.",0,2023-12-15 13:30:45,positive
7312696548553589509,7114425027651060741,wong.tulus1210,bule nya😱,0,2023-12-15 12:57:44,neutral
7312688859657208581,7090168546895135771,shaaa_pacarjunminggg,@PABOYA🐻🤡:GAMON SAMA JOGJA😭,0,2023-12-15 12:28:00,positive
7312687723561779973,6896019311790900226,belvia2912,kenangan tak terlupakan walau pun hanya 2hari di jogja,0,2023-12-15 12:23:23,positive
7312686938644529925,7223073888467747841,ulfiyaz44993,I am.coming jogja 🤩,0,2023-12-15 12:20:31,positive
7312661754726548229,6945349121793262594,maullltaqq_,sedih study tour gabisa berhenti di Malioboro soalnya ramai dan bus aku gak dapet parkir,0,2023-12-15 10:42:47,negative
7312654009746162438,6836145369593070594,shrlyg_20,PENGEN KE YOGYA!!!,0,2023-12-15 10:12:37,positive
7312647618994864902,6790254543369864193,phb667,@medicalspa28,0,2023-12-15 09:47:52,negative
7312640741490361094,6950867879466664961,artaaa_04_11,pliss pas kmrn ak ke Jogja nyasar sama rombongan 🥲🙏🏻,0,2023-12-15 09:21:16,negative
7312629583215280901,6760551423316018178,anin__098,JOGJA AKU AKAN KESANA LAGI TUNGGU AKU,0,2023-12-15 08:37:59,neutral
7312620583728399110,7094970696179205121,ddwiagtna,AYO KE JOGJAAA AKU GAMON BGTT😭😭,0,2023-12-15 08:03:11,neutral
7312606693518934790,6522605312087818241,ownercimy,"tunggu aku ya, tgl 20 cusss☺️",0,2023-12-15 07:09:18,neutral
7312597917532439301,7179180632407720962,enambelassyams1dar,@nisa,0,2023-12-15 06:35:03,negative
7312586507147133702,7202982767906653210,vinaangellita,jogja tunggu aku yh di sana,0,2023-12-15 05:50:50,neutral
7312579263734104838,6790489051663205377,chinonk94,"Jogja ,nanti tgl 123 aku kesana ya 🥰😊",0,2023-12-15 05:22:35,neutral
7312576771525755653,6883209920096076801,collbat_26,@bb 🦭,0,2023-12-15 05:13:05,negative
7312461510747538182,7223627003248526344,supercocodimple,@Naya:gamon sama Jogja itu nyata 😭,0,2023-12-14 21:45:38,positive
7312449711792374534,7100122871314744347,kmlsrndhaprlyaa,pengen ke Jogja lagii😭,0,2023-12-14 20:59:47,positive
7312448824022205189,7002954608625615874,rama_mmx,Jogja terbuat dari rindu ...🥰,0,2023-12-14 20:56:28,positive
7312446984420901638,7275271595542610946,rfslstruick,pengen ke jogja lagi,0,2023-12-14 20:49:13,positive
7312435199131255558,7074054738291540993,njazzzzzgh,tunggu jogjaa,0,2023-12-14 20:03:29,neutral
7312414584660722438,7234002851613164570,jaisyan_w.p,salfok sama cara duduk kakak hijab hitaam baju biru kok gitu ya😭😭😭😭😭😭😭,0,2023-12-14 19:42:21,neutral
7312419468133761798,7297933094262391814,kiilaa14,@xymzasq,0,2023-12-14 19:02:25,negative
7312416316568093445,6907075598675870722,prettynaaa16,waktu itu study ke jogjaa trs ke Malioboro di jump scaree inn samaa delmaaan trs pas pulng dri Malioboro di jump scare in lgi saamaa mbaa kuntii😭,0,2023-12-14 18:50:16,neutral
7312409789820175110,6696782794952590337,keruakt,setelah selesai kuliah skrng baru kerasa ternyata kangen juga sama jogja,0,2023-12-14 18:24:57,positive
7312406442168812294,6887422253743604738,sabiraashadd,"Jogja, aku usahakan aku akan kembali, tapi maaf jika aku tak bersama orang yg pernah berucap ingin kembali mendatangimu bersamaku",0,2023-12-14 18:11:54,neutral
7312385636999136005,6938293653912896514,_destjy,@PABOYA🐻🤡:GAMON SAMA JOGJA😭,0,2023-12-14 16:51:11,positive
7312359502371603205,7264510317609157638,atfa85,fypp ku Jogja semuaw,0,2023-12-14 15:10:17,positive
7312347352843993861,7049323710633706498,bungsu2010_,pengn tinggal lagi di jogjaa😭kangennn,0,2023-12-14 14:22:41,positive
7312340694771909382,6906015340264145921,naraeyya,"baru bangett semalem ke jogjaa, uda kangen lagii pengen kesanaa☹️☹️",0,2023-12-14 13:56:54,neutral
7312334109086434053,6708279905161053185,inijayaa,@Opik! Pengen kesini lagi,0,2023-12-14 13:31:28,positive
7312330209645675270,6865581214229791745,mydears09,jogja tunggu aku selepas tanggal merah natal yah.,0,2023-12-14 13:16:13,neutral
7312329491333890821,7041433234186372098,nadshaa_,KANGEN JOGJA TINGKAT DEWAA,0,2023-12-14 13:13:30,positive
7312317046481257222,7267420017984111622,keshaaxxxy,pngen ke jogja lagi pliss,0,2023-12-14 12:25:05,neutral
7312314835566953221,121897825172357120,nunnaranin,see u tgl 29 jogja,0,2023-12-14 12:16:29,neutral
7312307453965943557,6873363461183669250,indhaprilia24_,gamon sm jogja😭😭,0,2023-12-14 11:48:00,negative
7312291798062318342,6553909610863591425,selviana_fitria,bismillah Desember akhir kesini 🥰,0,2023-12-14 10:47:02,neutral
7312289489576428294,7290552079218295814,akhtacewejahat,kemarin habis ke jogjaaa wkwk,0,2023-12-14 10:38:06,neutral
7312271134391698181,6584764443435024385,fetafernandaa,Jogja kota kelahiran teecinta,0,2023-12-14 09:26:52,positive
7312267522433942277,6746707793162994690,rararara._11,jogja tunggu aku ya meii aku kesanaaa,0,2023-12-14 09:13:00,neutral
7312236346965345029,6764328010700702722,riri_justrianti,"yaallahhh ini kota impian aku bnget buat nerusin pendidikan, tpi skrng udh ngk di izinin lgi krna sering sakit² klw pas skit jg sering pingsan😭",0,2023-12-14 07:12:06,negative
7312113700973740806,7020894759380616193,pitatull_,aku baru pung dari sana,0,2023-12-13 23:15:54,neutral
7312104111263122182,7078919981849969666,anth3ony,Pgn bgt,0,2023-12-13 22:38:37,negative
7312102246975505157,7273640155625194502,wndaas14,Jogjaa tunggu aku ya hari kamis tgl 14 beso aku otw kesana❤️,0,2023-12-13 22:31:31,neutral
7312100964108993286,6802111894260106241,wiraevana,"jadi kangen nginep di hotel pop tu, sama jalan jalan🥲",0,2023-12-13 22:26:24,positive
7312079434223354630,7077163134549820443,maulanaadityanugraha,kangen jogja padahal baru kemarin kesana,0,2023-12-13 21:02:59,positive
7312077624893129478,6536038833779507201,audreyghazani,jogja tunggu aku ya tanggal 16 desember,0,2023-12-13 20:55:57,neutral
7312070269429482246,6991991133661316098,naelaaaaaa9,kangen bgt sama jogja,0,2023-12-13 20:27:26,positive
7312060464279782149,7123500782104396827,matt3wh,ke Jogja berkali kali ttp ga bosen 😔,0,2023-12-13 19:49:26,neutral
7312049663333974790,6851031096742757378,st4rdust.k,"Jogja aku kesana lagi akhir pekan Minggu ini, tapi dengan orang yang baru ya",0,2023-12-13 19:07:26,neutral
7312046900949451525,6531535106250670081,d.f_1308,"kangen, pengen ke Jogja lagi",0,2023-12-13 18:56:50,positive
7312044584003109638,6630115604530085889,secret.raaa,kangen Jogja 🙂,0,2023-12-13 18:47:49,positive
7312042606983414533,7046240840893285377,jjjjuuuuwwwwaaaa,lbh suka toilet yg di bwh ruanganya,0,2023-12-13 18:40:03,positive
7312038662228148997,6790332107869864961,anakeratna,gass dr surabaya jogja tgl 23-26 pulkam,0,2023-12-13 18:24:43,neutral
7312032920456643334,6871179639696491521,gc.zz1,@Aileen:kota Yogyakarta seribu kenangan,0,2023-12-13 18:02:30,neutral
7312021315631448838,7289681379183494149,chy2603,Wait for us jogja @syerinderis,0,2023-12-13 17:17:27,neutral
7312010344401896198,6938783224483480578,6jun07,plis siapapun gas ke sini 😞,0,2023-12-13 16:34:57,positive
7312010071172629254,7283393738319053830,mhmffff4,"ugm, jogja Tunggu aku ya",0,2023-12-13 16:33:50,neutral
7312009342503830277,7018221172294927386,itsme_ciayang,"jogja, im coming 😍",0,2023-12-13 16:31:02,positive
7312006829646447365,7247364304482911237,lovelythv22,"jogjaa tunggu aku yaa, February akuu kesana",0,2023-12-13 16:21:18,neutral
7311999690684662533,6847296645384111105,jhnfrnnd_,@raa🌷,0,2023-12-13 15:53:34,negative
7311994341134877445,6995159611615577114,4lenttt,KANGEN JOGJA PADAHAL BARU 2 HARI PULANG,0,2023-12-13 15:32:45,positive
7311969992651703045,6948252819791397889,onty.nyaabe,Bismillah Januari ke jogja ❤,0,2023-12-13 13:58:30,neutral
7311950070546629381,7290525906027889670,aliyyaaakh,minggu depan gue ke sana,0,2023-12-13 12:41:11,negative
7311944881293886213,7078096840709293061,sifaaaaaa50,cita cita gwe pengen punya rumah di jogja😭😭,0,2023-12-13 12:20:50,positive
7311942495440470790,7115210597461509121,ifth_nt,Jogja tunggu ya nanti malem aku mau ke situ,0,2023-12-13 12:11:43,neutral
7311940716786877190,7117279007192073242,olyn.je,kayaknya gua kalau di Jogja betah bet jalan jalan,0,2023-12-13 12:04:49,positive
7311934050037007109,6883124354206630913,25mj02,buat kek gini juga dong yang versimu @NadyaKamisaputri,0,2023-12-13 11:38:50,negative
7311926070378087173,6952710016047858690,frscc_,"pngin ke Jogja, seengganya 1x seumur hidup🥺",0,2023-12-13 11:07:55,positive
7311925744707060485,7097526290509038618,naudyauni,dejavuuuu,0,2023-12-13 11:06:38,negative
7311923916930384645,7001688999224099867,nauranih0,jogja tunggu aku taun depan,0,2023-12-13 10:59:35,neutral
7311893094836093701,6882380538197345282,ayuagstn0508,"fyp saya jogja mulu perasaan, curiga tahun depan ke Jogja 🥰🙈",0,2023-12-13 09:00:05,positive
7311763822950449925,7212250408961852443,devitaa1.2,aaa jogjaaa baru aja pulang dari sana😍,0,2023-12-13 00:38:10,negative
7311759999322374917,7231561697747747846,ini.balgis,SEBELUM MATI HARUS KE JOGJA!,0,2023-12-13 00:23:21,positive
7311759166673584902,6833059195907015681,fitriabeyy_,Jogja tunggu aku tahun depan ♥️,0,2023-12-13 00:20:08,positive
7311731159338107654,6876255477224834049,iyaaaja_,jatuh cinta banget sama jogja.,0,2023-12-12 22:31:22,positive
7311726556250292998,6992926230539207706,abd_iel1,Huhuhuuhuu,0,2023-12-12 22:13:39,negative
7311715335185859334,6958666480977134598,rimadaniati345,Insyaallah tgl 17 kejogya.Aamiin ya Allah,0,2023-12-12 21:30:03,neutral
7311693118415635206,7144697475944416257,ijaaa_26,@kelas6cisthebest ayok min kapan lagii😁,0,2023-12-12 20:03:54,neutral
7311686413903840006,7063191406046856193,ktutwdyy,ak Masi disini😍,0,2023-12-12 19:37:49,positive
7311685382516097797,6892353261585269761,aeriwm,bolak balik jogja pun ga bakal bosen,0,2023-12-12 19:33:50,neutral
7311678042644235014,7130129123464922114,kidukuhsakti,"Jogja
next time aku kesana lagi 🙏",0,2023-12-12 19:05:30,negative
7311675742957781766,6782332610430927874,chocolacaa,kobisa ngerekam geserny smooth bgd,0,2023-12-12 18:56:33,neutral
7311672078943257349,6701423490023113730,strawberry_xyy,@laaa🦋,0,2023-12-12 18:42:13,negative
7311658568716845829,6974185475050832898,inisialanisaa,@wndsrmaitri_ jgn lupa bikin vid gni nnti kl dijogja 😭,0,2023-12-12 17:49:54,negative
7311646046655546117,6965353402201785350,cloudzrhdry_,@sip🅰️:GASABARR STUDY TOURR,0,2023-12-12 17:01:15,neutral
7311624438944154373,6912610621755114498,ta.nitaajaa,@nad ddi pgn ng jogja 🥲,0,2023-12-12 15:37:31,negative
7311588724013777669,6937663266227733506,kvseagdmbdjansjl,"Jogja tunggu aku yaa,akhir tgl akhir nanti aku kesanaaa",0,2023-12-12 14:52:16,neutral
7311603476257325830,7284473018909787141,only.ni_,kangen jogjaaaaa!,0,2023-12-12 14:16:14,positive
7311602952170193670,7290799967924798469,syifaasukagalauu_,"@ilyyunns🩰🌷:JOGJAAA AKU RINDU
@Pisces🦋:jogja aku kangen bangett:)",0,2023-12-12 14:14:06,positive
7311584729660556037,7039062530811823130,fdla_aprl,aaa dejavuu st di sana brg tmn lama😭,0,2023-12-12 13:03:31,positive
7311579815425114885,7305409225386165253,cookies_azzh,@PABOYA🐻🤡:GAMON SAMA JOGJA😭,0,2023-12-12 12:44:22,positive
7311573530722009861,7059960978033886209,careellie,"jogja tunggu akuu yaa,feb aku kesanaa",0,2023-12-12 12:20:01,neutral
7311567159573512966,7251962861525419014,utami8476,"jdi pengen ke kampung lagi , rindu ww !!",0,2023-12-12 11:55:11,positive
7311558755374629637,7206555241901605915,xianjiing,woii 22 Desember ga sabar anjieee,0,2023-12-12 11:22:25,negative
7311552967830668037,7012104801707246598,afloryn_,malio tungu aku,0,2023-12-12 11:00:01,neutral
7311535674066682629,6939103831402677250,adintya,"wishlist aku tahun depan sama mas pacar ke jogjaaaaa🥰, bismillah",0,2023-12-12 09:53:11,positive
7311534653918954246,7013729022325785601,susuultratro,kangen kesanaaaa😭,0,2023-12-12 09:49:04,positive
7311494011226276613,6967652022619522050,pelariyangtertidur,"Alhamdulillah masih stay di sleman,,dari palembang insya allah nunggu thn bru ke malioboro lg😍",0,2023-12-12 07:11:18,neutral
7311400028874261253,6578716583878967297,aisyaaii_,aaaa kangen jogja🥺,0,2023-12-12 01:06:35,positive
7311392088011457285,6799468186985382913,arora639,Info dong yg dari Bengkulu mau jalan2 ke Yogyakarta cewek ?🙏🏻😂,0,2023-12-12 00:35:43,neutral
7311385466502382342,6540357918515937282,girlgem8,jogja se aesthetic itu ya 🥺,0,2023-12-12 00:10:05,negative
7311380416542311174,6942161966786839554,user9283828777086,Jogja tunggu aku🤎,0,2023-12-11 23:50:19,neutral
7311366373774082821,7170310326365160449,xyre_rex,hai guys besok Selasa male aku mau ke Jogja mau tanding karate doa'in menang ya!😁,0,2023-12-11 22:55:52,negative
7311361870487814917,7251412602910245889,01_ifla,@sdion.24,0,2023-12-11 22:38:21,negative
7311345319450575621,7211842355627295745,itsme_piraa,KANGENN JALAN JALAN KE MALIOBORO/JOGJAA🙃🙃,0,2023-12-11 21:34:12,neutral
7311340978819482373,6811346025127674881,haiiidewii,jogja tunggu yaa april aku kesanaa🥺,0,2023-12-11 21:17:22,neutral
7311312600200430341,7028099883311662081,alesha_mikayla03,"pgn nn kesni,, pyu liburan be2🥺",0,2023-12-11 19:27:13,negative
7311296857778782981,6528216665572802561,y0urgurl9,miss u malioboro🥺🥺,0,2023-12-11 18:26:16,neutral
7311288718194639621,7247106976823788552,cappucinooo_136,Jogja vibes nya sama kek bandung,0,2023-12-11 17:54:38,negative
7311282951709639430,7048966047936054274,lunlun_aay,"tunggu aku jogja, dan tunggu aku ugm",0,2023-12-11 17:32:14,neutral
7311267298735719174,7168048664605885441,pidiepixie,pengen ke jogja😭,0,2023-12-11 16:31:34,positive
7311252097131070213,6863014920427013122,mldrmh,jogja tunggu Januari aku kesana🥺,0,2023-12-11 15:32:40,neutral
7311251432875180805,6971286633162310662,daniankhendri_2,kangen jogja tapi ada dianya waktu itu😳,0,2023-12-11 15:30:10,positive
7311222666232054534,7059356699871118362,kuotahabisu,@jougan,0,2023-12-11 13:38:24,negative
7311214300126806789,6658450607748612097,z4rraa._,sekangen ituuu 😔😔,0,2023-12-11 13:06:01,negative
7311211273344860934,7221787807278335003,si_anjay_77,@F for Faraa faraaaa,0,2023-12-11 12:54:09,neutral
7311196928715784966,7306537051561247749,ivaaaaaja13,"""jogja vibes nya kamu banget""",0,2023-12-11 11:58:27,positive
7311189630148494112,7246902021780374555,panggilsajanayl,"jogja tungu aku ya , febuari aku ke situ",0,2023-12-11 11:32:13,neutral
7311154906429424389,6904059197366699009,minicollectionbajubodo,Pengen ke jogja 🥰,0,2023-12-11 09:15:28,positive
7311112059538588421,7056779854658454529,calon_hjh,@Fadiah✨,0,2023-12-11 06:29:12,negative
7311098273665172229,6953562116369482754,ngkushngestalk,"2 tahun di jogja ngerasa masih kurang, kangen banget sama temen² disana udah kayak saudara😭😭",0,2023-12-11 05:35:41,positive
7311023442101879558,7150602613444117531,yellowww___,jogja bln des ujan gak,0,2023-12-11 00:45:07,neutral
7311017218639577861,6513455827582468097,rahmah_lashes,Bismilah tunggu Jogja Januari aku kesana 🥰,0,2023-12-11 00:20:57,neutral
7310994055307019013,6808106883158049794,deviawinata08,impian aku pengen banget bisa ke jogja lagii 😳😳,0,2023-12-10 22:51:09,neutral
7310979868938142469,6788527976386102273,neeeeng5,Jogja tunggu aku yaaa❤️,0,2023-12-10 21:56:06,neutral
7310975117022872326,6665556510113005569,elicaadw,@🪐 ayo ikut ak pulkam ke jogja,0,2023-12-10 21:37:41,neutral
7310974084069524230,6866689228554716162,johnkyeom,jogjaa tunggu aku seminggu lagii,0,2023-12-10 21:33:39,neutral
7310965860112679685,7159874436266312706,sitikh1002_,kangen jogja🥺 ditunggoni ra sugeh2 ditinggal kangen😢,0,2023-12-10 21:01:40,positive
7310954166317679366,7210530038327477250,ameelraa,jadi kangen sama jogjaaa bulan kmrn baru ke jogjaaa😁,0,2023-12-10 20:16:14,positive
7310925226753557254,7256208040905802753,manusyaaaa_123,bismillah January too Jogjaaaaaaaaa,0,2023-12-10 18:24:07,neutral
7310915663370158853,6930563463635076097,ghfronfhmy,Jogja with you,0,2023-12-10 17:46:53,neutral
7310911855891071749,7022893961841558555,syargata2709,tunggu aku jogjaa,0,2023-12-10 17:32:13,neutral
7310888251275297542,7226001678791672859,maesaaaaa29,ke jogja brengg keluarga🤍,0,2023-12-10 16:00:43,positive
7310816770524742406,7297123688900756485,always.zza,"jogja tunggu aku yaa,tahun depan aku kesanaa",0,2023-12-10 12:41:11,neutral
7310827283387646726,7235995653208441861,xyzlzz1,gua kangen Jogja,0,2023-12-10 12:04:01,positive
7310821818020709126,7222195456607355911,secbinnnnnn,@dindaaaa:KANGEN JOGJAAA,0,2023-12-10 11:42:50,positive
7310821797439980294,7102749423738962945,ngab.awa,JOGJA TUNGGU AKU YAAA,0,2023-12-10 11:42:49,neutral
7310821544132657925,6897357977209455618,elvndw,@.:Jogja tunggu aku yaa🥹,0,2023-12-10 11:41:45,neutral
7310808488098497286,7308719920824976389,nottmahen,"Jogja, aku kuliah nanti disana.",0,2023-12-10 10:51:03,neutral
7310807548579349254,6550255939949101057,apyiyiyi,jogja tunggu aku🥺,0,2023-12-10 10:47:22,neutral
7310790113076675334,6882372655606432770,syaaa2672,"@Sagitarius girls:i'am coming jogja
sbr ya dlm waktu dkt bakal kesana 😍",0,2023-12-10 09:39:52,positive
7310772330484089606,6992607123314164762,zeaverellea,"aku,kamu,dan jogja..",0,2023-12-10 08:30:48,neutral
7310670634388210437,6787793920765936641,xyuu7666,kemaren baru pulang dari sana,0,2023-12-10 01:56:12,positive
7310648238007894790,6996153070422606849,cucu_gamon,hari ini aku ke jogjaaaaa,0,2023-12-10 00:29:12,neutral
7310615269364990725,7226369694331175962,adiva2272,Jogja aku kangennn,0,2023-12-09 22:21:13,neutral
7310602133211202309,6783884589943555073,atareeq_,"Kemarin baru kesini, emang jogja se istimewa itu 💚",0,2023-12-09 21:30:11,neutral
7310601317591335686,6707947172791485441,kyllasl,"jogjaa tunggu aku ya,tahun depan aku kesanaa",0,2023-12-09 21:27:01,neutral
7310590350317060869,7289112480688669701,anotherorel_,"Aku, kamu, dan jogja 2025",0,2023-12-09 20:44:31,neutral
7310571769780863749,6950982429923148801,hwahw5,gua pernah kesitu Malioboro bagus coy apalagi candi Prambanan ada bule poto poto di candi tapi itu hanyalah kenangan ☹️☹️☹️,0,2023-12-09 20:21:52,neutral
7310579545131041541,6865507735585440770,cayacaca1,terlalu indah buatt jogjaa 😭💗💗,0,2023-12-09 20:02:34,positive
7310574066392761094,7253467795673269253,tyvcd4,pengen ke Jogja lgi🙂,0,2023-12-09 19:41:19,positive
7310570355176850181,7028959547919221766,dindaaa_445,KANGEN JOGJAAA,0,2023-12-09 19:26:59,positive
7310559788776538885,7159389893805949953,alivjay,@ull @zazkiya _1248 @pertemanan hancur😵🤘 vibes,0,2023-12-09 18:45:55,neutral
7310553746139513606,6914898438706955266,asfamsh,@sundaempire22,0,2023-12-09 18:22:31,negative
7310536931519496965,7283386082711897093,coklatloplov,kata aku kalo ke jogja vibes nya kaya gabisa di lupain,0,2023-12-09 18:12:21,positive
7310545630123623174,76554343559,sukakopii1_,"mau kejogyaa blm kesamapai an,,bismillah awal taun bisa kesana brng suamii",0,2023-12-09 17:51:03,neutral
7310542591991644933,6763245571195339777,ndyasyafi,TUNGGU AKU YA JOGJA,0,2023-12-09 17:39:12,neutral
7310534823762871046,6885737759497405441,ibearynoz,@$$ mau kesini bareng ga?,0,2023-12-09 17:09:04,positive
7310507654190990085,7246404728526996481,supermineee_grills,kangen jogjaa,0,2023-12-09 15:23:50,positive
7310492516167353093,6917567697011540993,iyo_ikiaku08,otw tanggal 22🙌🏿 @enemaasixx Yo a,0,2023-12-09 14:25:03,neutral
7310486435008856837,7169118772133184514,danielkarim27,kangen,0,2023-12-09 14:01:20,positive
7310477090544435974,7307906857636512773,kajeshaisyourgirlfriend,Gw prnh beli di jogja distro tuhh,0,2023-12-09 13:25:06,positive
7310476914991678214,6551908658363023361,erlinnadha,@phiyukireina @LAUNDRY EXPRESS MOJOKERTO,0,2023-12-09 13:24:23,negative
7310474207934186245,6936897778148770817,gadihminang_bell,❤️❤️,0,2023-12-09 13:14:00,negative
7310470210573812485,6935646781591307265,indhadzma,jogjaa tnggu akuu yaa bsok aku kesanaa,0,2023-12-09 12:58:29,neutral
7310467757626999557,7031382368541213723,user3095676432341,bagus ❤,0,2023-12-09 12:48:53,positive
7310448376309891846,7054853096074413057,syaaqilla_,dulu sering bgt ke jogja😔,0,2023-12-09 11:33:43,positive
7310444383831311109,6991768428227265562,yeslin_roblox,Semoga Akhir Desember Bisa Ke Jogja 😌,0,2023-12-09 11:18:07,neutral
7310443229417210630,6872552633102648321,xkaa_17,@PABOYA🐻🤡:GAMON SAMA JOGJA😭,0,2023-12-09 11:13:47,positive
7310433627200553733,7094266595887006722,nrahn_kh,kangen Jogja,0,2023-12-09 10:36:33,positive
7310381379376005893,7130817999107785754,sayahulwaaa,"Bandung & Jogjaa,, please tunggu aquuuu wishlist aq bakal aku kejarrr insya Alloh",0,2023-12-09 07:13:50,neutral
7310358667185685254,7014451968345375770,_nn4d11aa,@naura:pgn ke jogja lagii 🥹🫶🏻,0,2023-12-09 05:45:41,negative
7310292149495464709,7040387857495737345,aelsssss_,pengen kesana lagii aaa tp bareng papa 🥺,0,2023-12-09 01:27:18,neutral
7310289337107120901,6566482402804989954,jeyy..4,@Sdr,0,2023-12-09 01:16:28,negative
7310268522277847814,6842910647169270786,nunnnn248,@ncii_baee,0,2023-12-08 23:55:47,negative
7310267472489775877,7032097740101108762,sheurylia,Suatu hari aku akan ada di sana bersama keluargaku,0,2023-12-08 23:51:42,negative
7310232264838005510,7072613467518272539,anakrumah316,da herah aku nogosari,0,2023-12-08 21:34:55,neutral
7310227693436977926,6914524823893574658,myelsee,@ticaaaa23 syahduuu bgt sihh,0,2023-12-08 21:17:14,negative
7310220990142694150,6582820200738734086,pinkysoppi,mau ke jogjaa😔,0,2023-12-08 20:51:15,neutral
7310217438195958533,7128644429644366854,pertiwi.21,aaaa pingin nangis mas gua wisuda ke Jogja tapi gua gk bisa ikut karena ujiann FYP nya kok bisa pas ya,0,2023-12-08 20:37:26,neutral
7310190829787464453,7210205361634444289,tisanputrimaghfiroh,kangen pas studytour kesana,0,2023-12-08 19:35:22,neutral
